post_id,title,author,score,upvote_ratio,comments,flair,is_video,is_self,domain,url,created_utc,selftext,extracted_time
1q6t341,"r/singapore random discussion and small questions thread for January 08, 2026",AutoModerator,13,1.0,163,,False,True,self.singapore,https://www.reddit.com/r/singapore/comments/1q6t341/rsingapore_random_discussion_and_small_questions/,2026-01-07 22:00:48,"*🌻☀️Good morning all have a great day and stay strong, stay safe and stay healthy! Jiayou!* Talk about your day. Anything goes, but subreddit rules still apply. Please be polite to each other!",2026-01-08 08:51:40.608234
1q72mc1,"More than 57,000 Malaysians gave up citizenship for Singapore over last 5 years",thestudiomaster,291,0.98,152,Tabloid/Low-quality source,False,False,asiaone.com,https://www.asiaone.com/singapore/more-57000-malaysians-gave-citizenship-singapore-over-last-5-years,2026-01-08 04:49:58,,2026-01-08 08:51:40.608252
1q6yqdx,Woman arrested at New Zealand airport after 18kg of meth found on arrival from Singapore,lemonmangotart,278,0.97,87,News,False,False,channelnewsasia.com,https://www.channelnewsasia.com/world/new-zealand-woman-18kg-methamphetamine-singapore-flight-5832611,2026-01-08 01:51:12,,2026-01-08 08:51:40.608265
1q6zvvn,Steven Lim Overshares About Girlfriends Past In Livestream Announcing Their Breakup,FlipFlopForALiving,216,0.87,95,Tabloid/Low-quality source,False,False,8days.sg,https://www.8days.sg/entertainment/local/steven-lim-lihui-oversharing-852386,2026-01-08 02:41:20,,2026-01-08 08:51:40.608277
1q72txk,"Keep money out of politics, or else people with more money will have more influence: SM Lee",Thefunincaifun,105,0.91,69,Tabloid/Low-quality source,False,False,mothership.sg,https://mothership.sg/2026/01/sm-lee-money-politics/,2026-01-08 05:00:38,,2026-01-08 08:51:40.608288
1q72ehd,Its a contravention of international law: SM Lee on US military intervention in Venezuela,fatenumber,86,0.92,37,Tabloid/Low-quality source,False,False,mothership.sg,https://mothership.sg/2026/01/sm-lee-us-strike-venezuela-contravenes-international-law/,2026-01-08 04:39:09,,2026-01-08 08:51:40.608299
1q70bzw,Things are still under-maintained for SMRT,UnprofessionalPlump,88,0.81,32,Image,False,False,i.redd.it,https://i.redd.it/xhyqa37qj1cg1.jpeg,2026-01-08 03:01:10,Nitpicking: but these little things matter from commuter experience. Ive been seeing this notice screen in this state since last year for a few months now at Chinese Garden MRT. Is it the least of the priority because west side is an ULU area compared to say like Changi?,2026-01-08 08:51:40.608321
1q71nuv,HDB set to pump up BTO flat supply further to moderate resale prices: Chee Hong Tat,stackeddd888,60,0.9,82,News,False,False,businesstimes.com.sg,https://www.businesstimes.com.sg/property/hdb-set-pump-bto-flat-supply-further-moderate-resale-prices-chee-hong-tat,2026-01-08 04:02:44,,2026-01-08 08:51:40.608331
1q6zd27,Bertha Henson on Haresh Singaraju and NMPs,Hot-Pain503,75,0.92,24,Politics,False,False,reddit.com,https://www.reddit.com/gallery/1q6zd27,2026-01-08 02:18:28,,2026-01-08 08:51:40.608341
1q76cwj,"After a fire at Hong Lim, a hawker couple reflects on loss and the future of their lifes work",QuietSkein,22,0.92,4,News,False,False,channelnewsasia.com,https://www.channelnewsasia.com/singapore/hong-lim-food-centre-fire-hawker-80-year-old-wife-business-5836426,2026-01-08 08:21:23,,2026-01-08 08:51:40.608350
1q6zyg8,"Changi Airport handled about 70 million passengers in 2025, an all-time high",Jonnyboo234,39,0.99,3,News,False,False,businesstimes.com.sg,https://www.businesstimes.com.sg/companies-markets/transport-logistics/changi-airport-handled-about-70-million-passengers-2025-all-time-high,2026-01-08 02:44:31,,2026-01-08 08:51:40.608360
1q66vfs,Halimah Yacob says Hwa Chong food looks good to her,AndyHaoHan,1497,0.94,440,Image,False,False,i.redd.it,https://i.redd.it/3ramfyfn4vbg1.jpeg,2026-01-07 05:25:58,"Well , case closed . Another back in my day story and how the food looks good to her . She forgets to mention that the food in these photos is priced at $3.60 to $4.80 . She should start going for these bento meals since they look good to her",2026-01-08 08:51:40.608381
1q6gedu,Seen somewhere in Bishan: Have you add magnetism???,Mysterious-Finding-6,234,0.98,86,Image,False,False,reddit.com,https://www.reddit.com/gallery/1q6gedu,2026-01-07 14:12:51,,2026-01-08 08:51:40.608390
1q6xm3o,Open Farm Community and Tiong Bahru Bakery Safari set to close on Jan 11,Great-Obligation-599,23,0.88,10,Opinion / Fluff Post,False,False,cnalifestyle.channelnewsasia.com,https://cnalifestyle.channelnewsasia.com/dining/open-farm-community-tiong-bahru-bakery-safari-closure-575151,2026-01-08 01:02:09,,2026-01-08 08:51:40.608400
1q6bzea,Heres what Spore students are eating for lunch under the new central kitchen model,Deliciouswizard,324,0.96,158,Tabloid/Low-quality source,False,False,mothership.sg,https://mothership.sg/2026/01/schools-central-kitchen-food-photos/,2026-01-07 10:32:10,Photo compilation by Mothership. Some look ok lah some look a bit cui (the wrap one).,2026-01-08 08:51:40.608415
1q63dw0,"Hwa Chong says viral meal photos do not reflect standards, but students verify images are accurate",FlipFlopForALiving,1103,0.98,357,News,False,False,channelnewsasia.com,https://www.channelnewsasia.com/singapore/hwa-chong-institution-sats-food-meals-quality-5827131?cid=internal_sharetool_iphone_07012026_cna,2026-01-07 02:41:45,,2026-01-08 08:51:40.608424
1q72ma7,Grab acquires AI robotics firm Infermove to boost delivery capabilities,nftskeptics,5,0.7,1,News,False,False,reuters.com,https://www.reuters.com/world/china/grab-acquires-ai-robotics-firm-infermove-boost-delivery-capabilities-2026-01-06/,2026-01-08 04:49:54,,2026-01-08 08:51:40.608433
1q6fbak,"Broken lifts, dark stairs: Bedok community hubs tenants raise concerns 3 months after opening",FancyCommittee3347,81,0.97,29,News,False,False,channelnewsasia.com,https://www.channelnewsasia.com/singapore/bedok-community-hub-safety-tenants-sla-peoples-association-fnb-customers-5836156?cid=internal_sharetool_iphone_07012026_cna,2026-01-07 13:26:45,"SINGAPORE: What was meant to be a vibrant revival of a community space in Bedok has instead become a source of frustration and financial strain for its tenants. Three months after its official opening, businesses at City Sprouts Bedok said that the facility is plagued by safety hazards and incomplete infrastructure that bear little resemblance to what they were promised.",2026-01-08 08:51:40.608453
1q6is31,"Woman challenging Singapore polices decision ordered to deposit $15,000 for potential legal costs",Jammy_buttons2,51,0.9,17,News,False,False,straitstimes.com,https://www.straitstimes.com/singapore/courts-crime/woman-challenging-spore-polices-decision-ordered-to-deposit-15000-for-potential-legal-costs?ref=top-stories,2026-01-07 15:44:42,,2026-01-08 08:51:40.608464
1q6k4d8,Four taken to hospital after pile-up involving four vehicles on CTE,Im_scrub,43,0.98,12,News,False,False,channelnewsasia.com,https://www.channelnewsasia.com/singapore/four-people-hospital-pileup-cte-5836091,2026-01-07 16:33:48,,2026-01-08 08:51:40.608473
1q6ack3,"As customers delay computer upgrades amid memory price surge, some Sim Lim Square retailers are feeling the pinch",Haunting-Owl,171,0.97,107,News,False,False,channelnewsasia.com,https://www.channelnewsasia.com/singapore/ram-memory-chips-ai-retailers-computers-price-hikes-micron-samsung-5824181,2026-01-07 08:50:05,,2026-01-08 08:51:40.608484
1q6jddx,3 more Sporeans caught littering in Johor under newly enforced anti-littering laws,fatenumber,42,0.93,5,Tabloid/Low-quality source,False,False,mothership.sg,https://mothership.sg/2026/01/singaporeans-caught-littering-johor-bahru-new-laws/?fbclid=IwdGRjcAPLY7hjbGNrA8tjq2V4dG4DYWVtAjExAHNydGMGYXBwX2lkDDM1MDY4NTUzMTcyOAABHnFTn4waN_OnbkmE-CPdBuzUBDcHvHIpqU_EKN5xabfFMBYD21OB3iNZ9wLb_aem_qJul9vtF0De2HlDTYSxp8Q,2026-01-07 16:06:17,,2026-01-08 08:51:40.608513
1q6eewh,Izwan Mahbud out on loan to Young Lions before Lion City Sailors Singapore Cup final,limhy0809,62,0.92,19,News,False,False,i.redd.it,https://i.redd.it/i2j2bvhyaxbg1.png,2026-01-07 12:44:56,Lion City Sailors have decided to loan out 2nd goalkeeper Izwan. The National teams starting keeper will be big boost to Young Lions. Risky move by Lion City Sailors to lose Singapores best goalkeeper with the Singapore Cup and Shopee Cup still to play for. A lot will now rest on Ivan who has struggled at times.,2026-01-08 08:51:40.608535
1q6bv8d,FirstCom Academy sues 2 ex-staff and rival training company but lost case,nospaces04,94,0.98,31,News,False,False,singaporelawwatch.sg,https://www.singaporelawwatch.sg/Judgments/PgrID/449/PageID/11,2026-01-07 10:25:29,hell hath no fury like an angry ex-boss case can be found here: [https://www.singaporelawwatch.sg/Portals/0/Docs/Judgments/2025/[2025]%20SGHC%20266.pdf](https://www.singaporelawwatch.sg/Portals/0/Docs/Judgments/2025/[2025]%20SGHC%20266.pdf),2026-01-08 08:51:40.608552
1q65ppz,"6 Sporeans caught littering in JB so far, Msia minister says: We want Spore to be clean, Msia even cleaner",sixpastfour,248,0.95,42,Tabloid/Low-quality source,False,False,mothership.sg,https://mothership.sg/2026/01/singaporeans-litter-jb-malaysia/,2026-01-07 04:27:42,,2026-01-08 08:51:40.608564
1q6fi7e,K-pop girl group Fifty Fifty to hold first performance in Singapore on May 9,silentscope90210,44,0.81,18,News,False,False,straitstimes.com,https://www.straitstimes.com/life/entertainment/k-pop-girl-group-fifty-fifty-to-hold-first-performance-in-singapore-on-may-9,2026-01-07 13:35:10,,2026-01-08 08:51:40.608575
1q6953p,Autobahn Rent A Car suspends vehicle rental business as debts mount,Im_scrub,122,0.97,48,News,False,False,channelnewsasia.com,https://www.channelnewsasia.com/singapore/autobahn-suspends-car-rental-business-private-hire-drivers-5831841,2026-01-07 07:33:27,,2026-01-08 08:51:40.608584
1q67k40,"Worlds tallest indoor vertical farm, valued at $80 million, opens in Singapore",G13lol2,111,0.95,38,News,False,False,straitstimes.com,https://www.straitstimes.com/singapore/environment/worlds-tallest-indoor-vertical-farm-opens-in-singapore,2026-01-07 06:02:32,,2026-01-08 08:51:40.608598
1q62qrd,Upper Serangoon Rd bus lane removed,A_extra,184,0.81,125,Opinion/Fluff Post,False,False,i.redd.it,https://i.redd.it/md14gmnb6ubg1.jpeg,2026-01-07 02:13:35,"LTA not having the balls to piss off drivers, as usual. Car-lite will never work unless they get some iron in them https://sgtransportcritic.wordpress.com/2024/08/30/bus-lane-mania-bto/ https://www.reddit.com/r/singapore/comments/1kcpy7f/part_of_bencoolen_streets_busonly_lane_removed/",2026-01-08 08:51:40.608631
1q6d974,Singapore forecast to reach 5.3 GW of solar by 2035,bardsmanship,31,0.93,1,News,False,False,pv-magazine.com,https://www.pv-magazine.com/2026/01/05/singapore-forecast-to-reach-5-3-gw-of-solar-by-2035/,2026-01-07 11:45:15,,2026-01-08 08:51:40.608641
1q65wtm,"Sporean teen punches & threatens dad with knife over allowance & air-con use, gets reformative training",Powerful_Office3936,108,0.95,31,Tabloid/Low-quality source,False,False,mothership.sg,https://mothership.sg/2026/01/teen-punches-threatens-dad-allowance/?fbclid=IwY2xjawPKwhZleHRuA2FlbQIxMQBzcnRjBmFwcF9pZAwzNTA2ODU1MzE3MjgAAR5MJOpdfZ1HjOrlz7SA_Yid11BAgOqWxv7lP6D5yRFbsUJskiwrxZ-WIJQu-w_aem_4VyADx7vhXIglWMemKqJcw,2026-01-07 04:37:33,,2026-01-08 08:51:40.608662
1q6729a,NLB introduces Fastback Collection: borrow popular titles for 7 days instead of the usual 21,random_avocado,83,0.95,12,Discussion,False,False,reddit.com,https://www.reddit.com/gallery/1q6729a,2026-01-07 05:36:12,"NLB has launched the Fastback collection, a curated selection of popular, in-demand titles meant for quick borrowing. Key details: • 7-day loan period (instead of the usual 21 days) • No renewal or reservation • Available only at Central Library and Punggol Library • Overdue fees apply if returned late 📆 7 Jan – 30 Jun 2026 📚 List of titles: go.gov.sg/nlb-fastback Good option if you just want to read a popular book quickly without waiting months for the hold queue.",2026-01-08 08:51:40.608724
1q5vrqy,"Spore woman, 103, gets elaborate final send-off with 16 tables, red carpet & paper slot machine",FancyCommittee3347,318,0.97,26,Tabloid/Low-quality source,False,False,mothership.sg,https://mothership.sg/2026/01/103-woman-large-wake/,2026-01-06 21:32:06,"A 103-year-old Singaporean centenarian has received an elaborate final send-off from her family and friends, complete with a large white tent, 16 tables, red carpet and a papier mâché slot machine. She is survived by her 14 daughters and sons, as well as 78 grandchildren, great-grandchildren, and great-great-grandchildren.",2026-01-08 08:51:40.608769
1q69x4k,Singapore rolls out new A-to-C food safety grading system based on F&amp;B outlets track record,mount2010,42,0.92,16,News,False,False,channelnewsasia.com,https://www.channelnewsasia.com/singapore/singapore-food-agency-new-grading-system-safe-5828306,2026-01-07 08:22:50,,2026-01-08 08:51:40.608806
1q66hed,Grab launches drone delivery pilot in Tanjong Rhu,Negative-Concert-819,73,0.91,41,News,False,False,channelnewsasia.com,https://www.channelnewsasia.com/singapore/grab-drone-food-deliveries-pilot-tanjong-rhu-5830541,2026-01-07 05:05:57,,2026-01-08 08:51:40.608815
1q5y1rv,Singapore–Kranji railway in the 1970s.,G13lol2,209,0.98,8,Image,False,False,reddit.com,https://www.reddit.com/gallery/1q5y1rv,2026-01-06 22:58:00,More photos in source: [https://searail.malayanrailways.com/KTM1970s/index.html](https://searail.malayanrailways.com/KTM1970s/index.html),2026-01-08 08:51:40.608831
1q615cq,"41 weeks jail for packer caught in vape warehouse with over 40,000 vapes and components",QualitativeEconomy,139,0.94,19,News,False,False,straitstimes.com,https://www.straitstimes.com/singapore/courts-crime/41-weeks-for-packer-caught-in-vape-warehouse-with-over-40000-vapes-and-components?ref=latest,2026-01-07 01:04:22,,2026-01-08 08:51:40.608842
1q60zbt,Singapore Employers Remain Cautious About Career Gaps as Hiring Confidence Falls and Demand for Skills Evidence Rises,Ok-Rain3348,129,0.92,48,News,False,False,finance.yahoo.com,https://finance.yahoo.com/news/singapore-employers-remain-cautious-career-234500701.html,2026-01-07 00:57:17,,2026-01-08 08:51:40.608853
1q65x79,China reviews Metas purchase of Singapore-based AI startup Manus: Report,thestudiomaster,60,0.91,37,News,False,False,channelnewsasia.com,https://www.channelnewsasia.com/business/china-review-meta-acquisition-manus-ai-singapore-5828021,2026-01-07 04:38:04,,2026-01-08 08:51:40.608863
1q66aos,Release of 2025 Singapore-Cambridge GCE O-Level Results & 2026 JAE,Wide-Garbage8960,32,0.89,3,News,False,False,moe.gov.sg,https://www.moe.gov.sg/news/press-releases/20260107-release-of-2025-singapore-cambridge-gce-o-level-examination-results-and-2026-joint-admissions-exercise,2026-01-07 04:56:37,"School candidates: 2pm Private candidates: 2.45pm Form A will be sent to registered email addresses from 2.45pm. JAE-IS will be accessible from 14th Jan, 4pm to 19th Jan, 430pm. JAE posting results will be out on 3rd Feb. All the best to everyone!",2026-01-08 08:51:40.608883
1q5eyhs,The Geylang Bahru murder of 1979 remains one of the most chilling and unsolved case till date in Singapores history,Newez,816,0.98,72,Opinion/Fluff Post,False,False,reddit.com,https://www.reddit.com/gallery/1q5eyhs,2026-01-06 10:23:49,"The Geylang Bahru family murders occurred in Singapore on 6 January 1979. All four children in the Tan family were found dead in their flat, at Block 58 Geylang Bahru. They were hacked, stabbed and slashed to death and their bodies were left piled on top of each other. The children ranged from 5 to 10 years of age at the time of death. Their parents, Tan Kuen Chai and Lee Mei Ying, were working at the time of the murders. The police interviewed over a hundred people who were possible suspects. However, the case remains unsolved.",2026-01-08 08:51:40.608908
1q66a13,What watches do Singaporean men/women wear for their daily driver?,Hot-Pain503,21,0.57,224,Discussion,False,True,self.singapore,https://www.reddit.com/r/singapore/comments/1q66a13/what_watches_do_singaporean_menwomen_wear_for/,2026-01-07 04:55:42,"When I was in Hongkong, I saw lots of men and women wear ROLEX watches (I know they might not be real). I wondered about the watch culture in SG and the kind of people and the watch they wear, not collect. What kind of watch do you wear and why? Edit: Thanks for alot of your comments very interesting to see Singaporeans mostly more function than style. Why did my post get downvoted so much haha oops",2026-01-08 08:51:40.608927
1q64m30,Part of Centrepoint mall up for en bloc sale,Illustrious-Gur8335,26,0.91,8,News,False,False,channelnewsasia.com,https://www.channelnewsasia.com/singapore/centrepoint-public-tender-collective-sale-part-strata-units-commercial-real-estate-5822976,2026-01-07 03:35:48,"A portion of The Centrepoint, one of Orchard Roads most iconic malls, has been put up for collective sale at a guide price of S$418 million, its marketing agent Savills Singapore said on Wednesday (Jan 7). The offering comprises 132 leasehold strata units, including 66 residential units and 66 retail units. The remaining 151 retail units, including those on the front facade of The Centrepoint, which faces Orchard Road, will not be part of the tender.",2026-01-08 08:51:40.608948
1q5c1c7,Came across this PUB ad with some interesting shophouse and props elements…,bangsphoto,621,0.97,126,Image,False,False,reddit.com,https://www.reddit.com/gallery/1q5c1c7,2026-01-06 07:21:01,,2026-01-08 08:51:40.608964
1q5a37f,"TIL Rajaratnam, who drafted the National Pledge, considered the Singapore governments policy of maintaining the racial balance to be stupid and dangerous",hatboyslim,671,0.97,255,Discussion,False,False,i.redd.it,https://i.redd.it/1tubixfb0obg1.png,2026-01-06 05:31:42,"From the article [Meritocracy, not race, is what counts: Raja (The Straits Times, 16 June 1990, Page 23)](https://eresources.nlb.gov.sg/newspapers/digitised/article/straitstimes19900616-1.2.37.8): >I think the business of maintaining the racial balance has been dropped. At least I havent heard about it for some time. As a Singaporean, I feel the word Singaporean must be race-blind, colour-blind… >Where in our Constitution does it say that there must be 75 per cent Chinese, 15 per cent Malays and 7 per cent Indians? It is stupid and dangerous... I think it was a wrong proposal. Once you are a Singaporean, then there is no race.",2026-01-08 08:51:40.609042
1q59ytg,Spore teachers can work from home on days with no classes among MOEs flexible work arrangements,InflationSimilar437,536,0.96,121,News,False,False,mothership.sg,https://mothership.sg/2026/01/singapore-teachers-work-from-home/?fbclid=IwdGRjcAPJa8hleHRuA2FlbQIxMQBzcnRjBmFwcF9pZAo2NjI4NTY4Mzc5AAEe8UD15eaTyBNk5PS3Ymrfojw13bmmQv1zJdzdKqQzFDVP82yQSow4QJAJUec_aem_Tz_Rpl5Qn-EeJH3TaeVHnQ,2026-01-06 05:25:34,"Teachers have lessons every day, so how often do they get to enjoy this? The most I can think of is days like marking days, National exams, or HBL days which only take place a few days in a year. This is like saying I give you free transport between 3am and 4am, or I let people who work in f&b wfh when theres no customers?",2026-01-08 08:51:40.609063
1q5d3vb,Woman accused of smuggling $5.5m of meth in checked luggage at Auckland Airport from Singapore,qbica,305,0.99,86,News,False,False,newstalkzb.co.nz,https://www.newstalkzb.co.nz/news/national/nz-woman-accused-of-smuggling-55m-of-meth-in-checked-luggage-at-auckland-airport/,2026-01-06 08:27:27,,2026-01-08 08:51:40.609073
1q5fjqw,NMP appointee Haresh Singaraju says he is no longer a PAP member after party shirt photo surfaces,RajahChamp,187,0.93,69,News,False,True,self.singapore,https://www.reddit.com/r/singapore/comments/1q5fjqw/nmp_appointee_haresh_singaraju_says_he_is_no/,2026-01-06 10:57:45,"[https://www.channelnewsasia.com/singapore/nominated-mp-haresh-singaraju-peoples-action-party-5826631](https://www.channelnewsasia.com/singapore/nominated-mp-haresh-singaraju-peoples-action-party-5826631) >**NMP appointee Haresh Singaraju says he is no longer a PAP member after party shirt photo surfaces** >Dr Haresh also said he had wrongly described the photograph as taken at a Peoples Association event. >SINGAPORE: Dr Haresh Singaraju, one of nine individuals set to be appointed as Nominated Members of Parliament (NMPs), has clarified that he is no longer affiliated with any political party after a photograph surfaced of him wearing a shirt with the Peoples Action Party (PAP) logo. >The family physician at National University Polyclinics initially told the South China Morning Post on Monday (Jan 5) that he was formerly a PAP member and that the 2023 photograph was taken at a Peoples Association event. >However, following a query from CNA, Dr Haresh issued a correction on Instagram on Tuesday. >In my response to SCMP, I had incorrectly referred to this as a Peoples Association activity. The activity did not involve the PA, he wrote, adding that he is now not a member of any party. >Dr Haresh said that the image was captured at a party activity where he had previously volunteered. The post, which had circulated as a screenshot online, has since been removed from his account. >He said the deletion was part of a clean up of the Instagram account, to protect the identities of individuals in the pictures as I made my account public. >CNA has contacted the PAP for comment. >The photograph has reignited online discussion about the independence of the NMP scheme, established in 1990 to bring non-partisan voices into parliament. >Similar concerns emerged last year when two NMPs – Mr Raj Joshua Thomas and Dr Syed Harun Alhabsyi – resigned in February, months before the General Election. Dr Syed Harun subsequently stood as a PAP candidate in Nee Soon GRC, and now serves as Senior Parliamentary Secretary for Education and National Development. >Mr Thomas was not fielded as a candidate. >Dr Haresh would not be the only former PAP member to be appointed as an NMP. >Several past appointees have had PAP connections: businessman Calvin Cheng and former NMP Tan Su Shan both resigned from the party before their appointments, while Dr Gerard Ee was still a PAP member when he assumed the position. >Dr Haresh is among eight new faces scheduled for appointment on Jan 8, alongside Mr Mark Lee Kean Phi, CEO of Sing Lun Holdings, who returns for a second term.",2026-01-08 08:51:40.609328
1q55nci,I dont know why but replacing the national flags with party flags is so funny to me given the history of the two parties,stupidpower,718,0.97,73,Image,False,False,i.redd.it,https://i.redd.it/mqago7o10nbg1.jpeg,2026-01-06 02:05:54,,2026-01-08 08:51:40.609339
1q5g9ex,"Singapore pawnshops disburse over S$5b in loans in first half of 2025, highest in a decade",Negative-Concert-819,86,0.97,18,News,False,False,channelnewsasia.com,https://www.channelnewsasia.com/singapore/pawnshops-loans-highest-decade-gold-prices-5809011,2026-01-06 11:36:56,,2026-01-08 08:51:40.609349
1q5dfpq,PizzaExpress Singapore shuts Millenia Walk and Scotts Square outlets; two operating stores remain,stackeddd888,139,0.98,42,News,False,False,businesstimes.com.sg,https://www.businesstimes.com.sg/singapore/smes/pizzaexpress-singapore-shuts-millenia-walk-and-scotts-square-outlets-two-operating-stores-remain,2026-01-06 08:48:41,,2026-01-08 08:51:40.609359
1q5wkq3,"r/singapore random discussion and small questions thread for January 07, 2026",AutoModerator,9,0.85,268,,False,True,self.singapore,https://www.reddit.com/r/singapore/comments/1q5wkq3/rsingapore_random_discussion_and_small_questions/,2026-01-06 22:01:42,"*🌻☀️Good morning all have a great day and stay strong, stay safe and stay healthy! Jiayou!* Talk about your day. Anything goes, but subreddit rules still apply. Please be polite to each other!",2026-01-08 08:51:40.609389
1q5azn5,How a photo reignited debate on neutrality of Singapores NMP scheme,One-Employment-4887,146,0.93,46,Tabloid/Low-quality source,False,False,scmp.com,https://www.scmp.com/week-asia/people/article/3338821/photo-singapore-nmp-ruling-party-shirt-reignites-debate-schemes-neutrality,2026-01-06 06:19:41,,2026-01-08 08:51:40.609400
1q53g6o,Clementi sees a new record with its first S$1.5M HDB resale,DrCalFun,271,0.93,163,Opinion/Fluff Post,False,False,99.co,https://www.99.co/singapore/insider/clementi-s1-5m-hdb-resale/,2026-01-06 00:34:16,,2026-01-08 08:51:40.609409
1q5b0yf,can we have a $10 deposit for cigarette box same theory as the 10-cent beverage container return deposit,Gamel999,87,0.73,63,Opinion/Fluff Post,False,True,self.singapore,https://www.reddit.com/r/singapore/comments/1q5b0yf/can_we_have_a_10_deposit_for_cigarette_box_same/,2026-01-06 06:21:45,"Saw this on FB just now, wonder if we can do the same for cigarette box or even cigarette buds. I see littered cigarette box/buds everyday in non-tourist area. you might ask if $10 is too much. but beverage container deposit is to encourage recycle. I see this $10 is a prepaid fine for littering Do anyone know how can I submit this idea to the gov? should i just drop an email to MPs? ----------------------------------------------------------------- 10-cent beverage container return deposit to begin in April, with longer transition period to clear stock [https://www.channelnewsasia.com/singapore/beverage-container-return-scheme-10-cents-deposit-april-2026-5787456](https://www.channelnewsasia.com/singapore/beverage-container-return-scheme-10-cents-deposit-april-2026-5787456)",2026-01-08 08:51:40.609433
