post_id,title,author,score,upvote_ratio,comments,flair,is_video,is_self,domain,url,created_utc,selftext,extracted_time
1q5bk5d,Is Singapore Airlines releasing fewer Saver awards?,Jonnyboo234,44,0.84,21,Opinion/Fluff Post,False,False,milelion.com,https://milelion.com/2026/01/06/is-singapore-airlines-releasing-fewer-saver-awards/,2026-01-06 06:52:20,,2026-01-08 08:51:40.609442
1q53pjg,Commentary: Independent senior living must be the norm in ageing Singapore,_IsNull,64,0.9,42,Opinion / Fluff Post,False,False,channelnewsasia.com,https://www.channelnewsasia.com/commentary/age-in-place-neighbourhood-nursing-home-community-care-apartment-5467766,2026-01-06 00:44:41,,2026-01-08 08:51:40.609451
1q4lx0w,Henry Lau on Singapore concert venue: I hope no other singers perform in this place again,DrCalFun,483,0.94,66,Tabloid/Low-quality source,False,False,asiaone.com,https://www.asiaone.com/entertainment/henry-lau-singland-festival-singapore-concert-venue,2026-01-05 13:39:11,,2026-01-08 08:51:40.609461
1q58ki9,Mao Shan Wang durian prices lowest in 10 years on back of bumper crop in Malaysia,outremer_empire,22,0.9,6,Video,False,False,youtu.be,https://youtu.be/bktO951sJ_I,2026-01-06 04:17:08,,2026-01-08 08:51:40.609471
1q4fdzb,As Someone who Prefers Xmas Music to CNY Music,shadowoflight,944,0.95,68,Meme,False,False,i.redd.it,https://i.redd.it/03blmghsghbg1.jpeg,2026-01-05 07:30:46,"This is what it feels like between 26-31 Dec every year for me lol. Mostly still xmas music, but then you hear 1 store here, another store there, starting to play CNY music immediately after Xmas day and its like wah lau dont so fast leh haha. (reposting coz removed coz I didnt post on a monday haha... oops.)",2026-01-08 08:51:40.609490
1q4zwio,New exhibition exploring innovations of Changi Airports future Terminal 5 launched,Great-Obligation-599,52,0.89,21,News,False,False,channelnewsasia.com,https://www.channelnewsasia.com/singapore/changi-airport-terminal-5-t5-in-making-exhibition-opens-public-5806111,2026-01-05 22:13:42,,2026-01-08 08:51:40.609509
1q4gwkz,Boy fractures nose at Jewel walking net attraction; BCA and operator urge visitors to follow safety rules and supervise children,lemonmangotart,378,0.97,131,News,False,False,channelnewsasia.com,https://www.channelnewsasia.com/singapore/boy-nose-fracture-jewel-changi-airport-walking-net-bca-safety-supervision-5806081,2026-01-05 09:06:09,,2026-01-08 08:51:40.609519
1q4jji2,The iconic gain city car placed on a pillar,BookkeeperLivid1938,208,0.96,11,Image,False,False,i.redd.it,https://i.redd.it/ev2jdi71qibg1.jpeg,2026-01-05 11:42:39,,2026-01-08 08:51:40.609528
1q4kyqb,Firefighters put out blaze at Raffles Institution,Illustrious-Gur8335,146,0.97,15,News,False,False,straitstimes.com,https://www.straitstimes.com/singapore/firefighters-put-out-blaze-in-raffles-institution?ref=top-stories,2026-01-05 12:55:49,"A fire broke out in an office at Raffles Institution (RI) on Jan 5. The Singapore Civil Defence Force (SCDF) said it was alerted to the fire, which involved the contents of a second-floor office in an administrative block of the school in Bishan, at 12.30pm. The fire was extinguished by SCDF firefighters with three water jets. It affected an area about the size of a five-room Housing Board flat, reported Chinese-language news outlet Lianhe Zaobao. SCDF said there were no reported injuries, and that the cause of the fire is under investigation. The Straits Times has contacted RI for more information.",2026-01-08 08:51:40.609592
1q4hxei,"TIL In 1987, Lee Kuan Yew sued a Malaysian newspaper after it alleged that he had persuaded MP Teh Cheang Wan to kill himself to cover up a larger corruption scandal",Newez,196,0.95,43,Opinion/Fluff Post,False,True,self.singapore,https://www.reddit.com/r/singapore/comments/1q4hxei/til_in_1987_lee_kuan_yew_sued_a_malaysian/,2026-01-05 10:09:55,"Teh Cheang Wan (3 March 1928 – 14 December 1986) was a Singaporean politician and architect who served as Minister for National Development between 1979 and 1986. A member of the governing Peoples Action Party (PAP), he was the Member of Parliament (MP) for Geylang West Constituency between 1979 and 1986. In November 1986, Teh was investigated by the Corrupt Practices Investigation Bureau (CPIB) for alleged corruption. Teh died by suicide on 14 December 1986 before he could be charged in court. https://en.wikipedia.org/wiki/Teh_Cheang_Wan",2026-01-08 08:51:40.609656
1q4a676,Introducing G-Chan,ji3mi,609,0.93,30,I Made This,False,False,i.redd.it,https://i.redd.it/9ydk1l3g5gbg1.png,2026-01-05 03:03:43,,2026-01-08 08:51:40.609665
1q4jhxf,Sabah! Sabah! Driver of Singapore-registered car caught pumping Ron95 petrol in Kedah,thestudiomaster,112,0.9,82,Tabloid/Low-quality source,False,False,asiaone.com,https://www.asiaone.com/singapore/singapore-car-kedah-ron95-sabah,2026-01-05 11:40:10,,2026-01-08 08:51:40.609676
1q4iupu,"Several Kith Cafe outlets shut in recent months, with 2 stores still operating",FlipFlopForALiving,115,0.95,70,News,False,False,straitstimes.com,https://www.straitstimes.com/singapore/several-kith-cafe-outlets-shut-in-recent-months-with-2-stores-still-operating,2026-01-05 11:03:27,,2026-01-08 08:51:40.609686
1q4ajh8,"Chinese woman, 34, found dead in MBS room, grieving parents hope to find more info on daughter",Newez,453,0.96,27,Tabloid/Low-quality source,False,False,mothership.sg,https://mothership.sg/2026/01/chinese-woman-dead-mbs/?fbclid=IwdGRleAPIDS9leHRuA2FlbQIxMQBzcnRjBmFwcF9pZAo2NjI4NTY4Mzc5AAEe-5OqCT7B6NVa_3bBONwMXgaEeVX0gW6fP-GmIqpkKQB8tvmW9tr19iWHvOY_aem_lW_Mxe1TpvPFVBFiqBVvUQ,2026-01-05 03:20:46,,2026-01-08 08:51:40.609695
1q45r5a,This is insane to me,kxiongw,758,0.95,134,Image,False,False,i.redd.it,https://i.redd.it/u3yo4are7fbg1.jpeg,2026-01-04 23:52:54,Its.. *time check* 0745. (The giveaways starts 0700) Quite insane for a breakfast event that supposed to last 2 hrs. Im guessing the next two days will be the same. I expected it to end early but not this early,2026-01-08 08:51:40.609709
1q4zket,"r/singapore random discussion and small questions thread for January 06, 2026",AutoModerator,12,0.88,375,,False,True,self.singapore,https://www.reddit.com/r/singapore/comments/1q4zket/rsingapore_random_discussion_and_small_questions/,2026-01-05 22:00:53,"*🌻☀️Good morning all have a great day and stay strong, stay safe and stay healthy! Jiayou!* Talk about your day. Anything goes, but subreddit rules still apply. Please be polite to each other!",2026-01-08 08:51:40.609739
1q4iuqe,"Maid agency employee duped clients into paying S$92,000 into his own PayNow account, gets jail",Negative-Concert-819,70,0.94,13,News,False,False,channelnewsasia.com,https://www.channelnewsasia.com/singapore/maid-agency-cheat-clients-paynow-own-account-5806096,2026-01-05 11:03:27,,2026-01-08 08:51:40.609751
1q4cbfx,"Spore man allegedly drops used tissue paper into tablemates food at Koufu, fight ensues, police called",Im_scrub,223,0.96,40,Tabloid/Low-quality source,False,False,mothership.sg,https://mothership.sg/2026/01/two-men-fight-food-court-tissue-paper/,2026-01-05 04:44:36,,2026-01-08 08:51:40.609761
1q4c7do,All Ngee Ann Poly students to learn generative AI from 2026,Illustrious-Gur8335,210,0.9,78,News,False,False,straitstimes.com,https://www.straitstimes.com/singapore/parenting-education/all-ngee-ann-poly-students-to-learn-generative-ai-from-2026?ref=top-stories,2026-01-05 04:39:13,"Instead of being taught as a standalone subject, Gen AI will be embedded across the curriculum, with all students – regardless of their course of study – using it every year in at least one module through a structured approach. Modelled on the PAIR framework – short for problem, AI, interaction and reflection – developed by Professor Oguz Acar, an expert in Gen AI at Kings College London, the approach will guide students through four steps: defining a problem clearly, selecting appropriate AI tools, testing them through hands-on use, and reflecting on how the technology influences their thinking and decisions.",2026-01-08 08:51:40.609830
1q4khyn,Why the Worlds Shortest International Train Is Disappearing,The_Celestrial,31,0.81,8,Video,False,False,youtube.com,https://www.youtube.com/watch?v=RTtUsYXhgQc,2026-01-05 12:32:21,,2026-01-08 08:51:40.609841
1q4gfay,Former DPM Heng Swee Keat relinquishes post as member of MAS board of directors,Same-Macaron-2359,66,0.88,15,News,False,False,straitstimes.com,https://www.straitstimes.com/singapore/former-dpm-heng-swee-keat-relinquishes-post-as-member-of-mas-board-of-directors,2026-01-05 08:35:26,Former DPM Heng Swee Keat has relinquished his position as a member of the MAS board of directors.,2026-01-08 08:51:40.609856
1q4can1,"Woman, 34, found dead on 2nd floor ledge of Hougang block",FancyCommittee3347,134,0.93,14,Tabloid/Low-quality source,False,False,mothership.sg,https://mothership.sg/2026/01/man-found-dead-hougang-2nd-floor/,2026-01-05 04:43:31,"A woman was found dead on the second floor of Block 375 in Hougang Street 31 on Jan. 5. In response to queries from Mothership, the police confirmed with Mothership that they were alerted to a case of unnatural death at 8.30 am on Jan. 5, 2026. A 34-year-old woman was found lying motionless at the said location and was pronounced dead at scene by SCDF paramedic. Based on preliminary investigations, the Police do not suspect foul play. Police investigations are ongoing. When Mothership arrived at the scene at 9 am, the body of the woman was still at the second-floor ledge above the rubbish collection point.",2026-01-08 08:51:40.609879
1q46aw9,A few days ago I learned OCBC had their own TV Show,EnvironmentalLion355,230,0.97,24,Discussion,False,False,i.redd.it,https://i.redd.it/pwt9970dbfbg1.jpeg,2026-01-05 00:15:04,"Mandy and her Mighty Adventures was a show that aired on Kids Central in the late 2000s. From what I could find its the kid and their magical companion formula, in this case, OCBCs Mighty Savers mascots. Kind of odd that it exists, but sure.",2026-01-08 08:51:40.609897
1q4kp2x,Hawkers Are Redefining What Local Food Means In Singapore | New Stirrings,Jammy_buttons2,20,0.81,8,Video,False,False,youtube.com,https://www.youtube.com/watch?v=Ue1z1UsaWw8,2026-01-05 12:42:28,,2026-01-08 08:51:40.609908
1q4dgyh,Soaring gold prices push Singapore buyers towards bars and coins over jewellery,DrCalFun,62,0.92,17,News,False,False,channelnewsasia.com,https://www.channelnewsasia.com/singapore/gold-prices-singapore-consumers-bars-coins-jewellery-5800526,2026-01-05 05:42:07,,2026-01-08 08:51:40.609918
1q4btcc,"2 taken to hospital after car skids in Adam Road, crashes into gas equipment and catches fire",wlscle,64,0.96,4,News,False,False,straitstimes.com,https://www.straitstimes.com/singapore/2-taken-to-hospital-after-car-skids-in-adam-road-crashes-into-gas-equipment-and-catches-fire,2026-01-05 04:20:18,,2026-01-08 08:51:40.609929
1q47p35,Map of Singapores early 20th-century tram network,G13lol2,62,0.91,19,I Made This,False,False,google.com,https://www.google.com/maps/d/viewer?mid=1AeZvZiEK9PG1-emwQ0gKldcn5ihfIYg,2026-01-05 01:14:01,Source of tramline alignment: [Map Of Singapore Showing The Principal Residences And Places Of Interests](https://www.nas.gov.sg/archivesonline/maps_building_plans/record-details/fac6ffc2-115c-11e3-83d5-0050568939ad) (1913) Source of tram routes and stops: [Federated Malay States Railways : pamphlet of information for travellers : tours in the Malay Peninsula](https://archive.org/details/cu31924011085457/page/n9/mode/2up) (1914; page 10),2026-01-08 08:51:40.609948
1q3nwll,Man who pumped RON95 petrol into Spore-registered vehicle is Spore PR: Johor police,fatenumber,714,0.97,254,Tabloid/Low-quality source,False,False,mothership.sg,https://mothership.sg/2026/01/man-pumped-ron95-singapore-pr/?fbclid=IwdGRjcAPHMIJjbGNrA8cwbmV4dG4DYWVtAjExAHNydGMGYXBwX2lkDDM1MDY4NTUzMTcyOAABHoklDmvpNfA3-W6LliQl2-bTOq_1KfMxDguN49uZJj9i5Z8E3Cvz4WomDrzQ_aem_78RS6d95kH2PSApEjGP5bg,2026-01-04 11:40:12,,2026-01-08 08:51:40.609958
1q5ek2w,The Weight of Optimism: Why I Still Believe in Youth Climate Advocacy After COP30,LegitimateCow7472,0,0.41,8,Tabloid/Low-quality source,False,False,ricemedia.co,https://www.ricemedia.co/weight-of-optimism-youth-climate-advocacy-cop30/,2026-01-06 09:59:32,,2026-01-08 08:51:40.609970
1q4a5ex,SGX rebrands equities business to SGX Stock Exchange as STI marks 60th anniversary,nftskeptics,35,0.91,17,News,False,False,businesstimes.com.sg,https://www.businesstimes.com.sg/companies-markets/sgx-rebrands-equities-business-sgx-stock-exchange-sti-marks-60th-anniversary,2026-01-05 03:02:46,,2026-01-08 08:51:40.609980
1q3qrm9,Anyone remembers the old Sun Plaza of yesteryears? Brought me a lot of memories while watching this..,Powerful_Office3936,339,0.97,85,Video,True,False,v.redd.it,https://v.redd.it/bnh9m3ppacbg1,2026-01-04 14:06:13,,2026-01-08 08:51:40.609991
1q3xkpw,SG from above,GuyinBedok,62,0.83,2,Photography,False,False,reddit.com,https://www.reddit.com/gallery/1q3xkpw,2026-01-04 18:33:20,,2026-01-08 08:51:40.609998
1q3iu58,"Spore gravely concerned by US intervention in Venezuela, urges all parties to exercise restraint",meesiammaihum,526,0.95,372,News,False,False,straitstimes.com,https://www.straitstimes.com/singapore/spore-gravely-concerned-by-us-intervention-in-venezuela-urges-all-parties-to-exercise-restraint,2026-01-04 06:37:16,,2026-01-08 08:51:40.610009
1q3mydo,Driving centres in Singapore hike learner fees in 2026,Zkang123,239,0.96,66,News,False,False,straitstimes.com,https://www.straitstimes.com/singapore/transport/driving-centres-in-singapore-hike-learner-fees-in-2026?ref=top-stories,2026-01-04 10:44:15,,2026-01-08 08:51:40.610020
1q3fxq4,Men abused by wives fear being seen as culprits: Counsellors on why such cases go under-reported,Jammy_buttons2,464,0.98,116,News,False,False,straitstimes.com,https://www.straitstimes.com/singapore/men-abused-by-wives-fear-being-seen-as-the-culprits-counsellors-on-why-such-cases-go-under-reported,2026-01-04 04:08:19,,2026-01-08 08:51:40.610030
1q3lfbw,Around 10 Tanjong Pagar Plaza massage and spa businesses shut as push for refresh continues,deangsana,142,0.97,46,News,False,False,straitstimes.com,https://www.straitstimes.com/singapore/around-10-tanjong-pagar-plaza-massage-and-spa-businesses-shut-as-push-for-refresh-continues?ref=top-stories,2026-01-04 09:11:31,,2026-01-08 08:51:40.610042
1q3def7,Why Singapore Kills Its Homegrown Champions | Inderjit Singh,nftskeptics,371,0.95,70,Politics,False,False,youtube.com,https://www.youtube.com/watch?v=BnWVOqg8GnA,2026-01-04 02:11:16,,2026-01-08 08:51:40.610052
1q42yz2,"r/singapore random discussion and small questions thread for January 05, 2026",AutoModerator,8,0.79,290,,False,True,self.singapore,https://www.reddit.com/r/singapore/comments/1q42yz2/rsingapore_random_discussion_and_small_questions/,2026-01-04 22:01:02,"*🌻☀️Good morning all have a great day and stay strong, stay safe and stay healthy! Jiayou!* Talk about your day. Anything goes, but subreddit rules still apply. Please be polite to each other!",2026-01-08 08:51:40.610085
1q3in4f,"Singapore and the US reaffirm partnership, look forward to deepening cooperation",Negative-Concert-819,100,0.85,51,News,False,False,channelnewsasia.com,https://www.channelnewsasia.com/singapore/pm-lawrence-wong-us-president-trump-reaffirm-partnership-phone-call-5786916,2026-01-04 06:26:26,"I look forward to visiting the United States later this year to mark this important milestone in our bilateral ties, and to deepen cooperation in new areas such as artificial intelligence, cybersecurity and civilian nuclear power, said Prime Minister Lawrence Wong following his phone call with US President Donald Trump.",2026-01-08 08:51:40.610103
1q3g7gf,Woodlands Health renamed as Woodlands Hospital,ImpressiveStrike4196,102,0.89,43,News,False,False,straitstimes.com,https://www.straitstimes.com/singapore/woodlands-health-renamed-as-woodlands-hospital,2026-01-04 04:21:16,,2026-01-08 08:51:40.610112
1q2kyws,We are feeding SG kids cookhouse food from Secondary School,taenyfan95,2601,0.96,690,Image,False,False,reddit.com,https://www.reddit.com/gallery/1q2kyws,2026-01-03 04:27:35,This is what secondary school kids at Hwa Chong Institution are given for lunch. I hope this doesnt become a trend.,2026-01-08 08:51:40.610125
1q2wpjo,"Girl, 13, missing since Dec. 30, last seen near Bedok Reservoir, family appealing for info",Jonnyboo234,167,0.83,33,FOUND,False,False,mothership.sg,https://mothership.sg/2026/01/missing-girl-bedok-reservoir-dec-31/,2026-01-03 15:01:51,,2026-01-08 08:51:40.610136
1q2ki2s,SG new limited edition license plate series: LJ with no suffix,nicky9499,803,0.97,212,Video,True,False,v.redd.it,https://v.redd.it/9g4q7ekc62bg1,2026-01-03 04:04:55,100% original ok,2026-01-08 08:51:40.610148
1q2l6hx,"On the topic of GST and service charge, I came across this restaurant using it as promo",bangsphoto,558,0.98,118,Image,False,False,i.redd.it,https://i.redd.it/y7u0unoec2bg1.jpeg,2026-01-03 04:37:48,"Not trying to promote the place but more to bring attention to the issue. Place is Hainan story at Tampines Mall. Despite this, there was still a waiter around to help with orders, but aside from that, its almost all self service.",2026-01-08 08:51:40.610165
1q37imz,"r/singapore random discussion and small questions thread for January 04, 2026",AutoModerator,16,1.0,377,,False,True,self.singapore,https://www.reddit.com/r/singapore/comments/1q37imz/rsingapore_random_discussion_and_small_questions/,2026-01-03 22:00:52,"*🌻☀️Good morning all have a great day and stay strong, stay safe and stay healthy! Jiayou!* Talk about your day. Anything goes, but subreddit rules still apply. Please be polite to each other!",2026-01-08 08:51:40.610194
